input,title,answers,url
java array,Why does Java have transient fields?,keyword java used indicate field part serialization means saved like file process java language specification java se edition section fields variables may marked indicate part persistent state object example may fields derived fields done programmatically rather state persisted via serialization class contains image thumbnail derived image example thumbnail image generated invoking method field marked original serialized rather persisting original image thumbnail image means less storage would needed save serialized object course may may desirable depending requirements system example time deserialization method called perform operations necessary restore state object back state serialization occurred thumbnail needs generated method overridden thumbnail generated calling method additional information article discover secrets java serialization api originally available sun developer network section discusses use presents scenario keyword used prevent serialization certain fields,https://stackoverflow.com/questions/910374
java array,"Is Java ""pass-by-reference"" or ""pass-by-value""?",terms quot pass value quot quot pass reference quot special precisely defined meanings computer science meanings differ intuition many people first hearing terms much confusion discussion seems come fact terms quot pass value quot quot pass reference quot talking variables pass value means value variable passed function method pass reference means reference variable passed function latter gives function way change contents variable definitions java always pass value unfortunately deal variables holding objects really dealing object handles called references passed value well terminology semantics easily confuse many beginners goes like example still return value within changed function object reference passed value passed reference would return call likewise example dog name call object name set inside operations performs practical purposes performed possible change value variable information pass reference pass value consult following answer https stackoverflow com explains thoroughly semantics history behind two also explains java many modern languages appear certain cases,https://stackoverflow.com/questions/40480
java array,What's the simplest way to print a Java array?,since java use arrays within arrays note version calls object array output even decorated exact way asking examples simple array output nested array output array output array output,https://stackoverflow.com/questions/409784
java array,Loop through an array in JavaScript,three main options detailed examples sequential loop pros works every environment use flow control statements cons verbose imperative easy one errors sometimes also called fence post error es specification introduced lot beneficial array methods one gave us concise way iterate array almost ten years time writing es specification released dec implemented nearly modern engines desktop server mobile environments safe use es arrow function syntax even succinct arrow functions also widely implemented unless plan support ancient platforms internet explorer also safe go pros short succinct declarative cons cannot use normally replace need imperative loops filtering array elements iterating example keep mind iterating array build another array use seen anti pattern many times anti pattern proper use case map also trying reduce array value example want sum array numbers use reduce method anti pattern proper use reduce es statement es standard introduces concept iterable objects defines new construct traversing data statement statement works kind iterable object also generators object property array objects definition built iterables es use statement pros iterate large variety objects use normal flow control statements useful iterate serially asynchronous values cons targeting older browsers transpiled output might surprise use zipcodeman suggests use statement iterating arrays avoided statement meant enumerate object properties used array like objects order iteration guaranteed array indexes may visited numeric order inherited properties also enumerated second point give lot problems example extend object include method property also enumerated example code console log quot quot quot quot quot quot quot foo quot particularly problem use library relies heavily native prototypes augmentation mootools statement said enumerate object properties example example method allows enumerate properties properties object physically inherited properties would recommend read following article enumeration vs iteration,https://stackoverflow.com/questions/3010840
java array,Copy array by value,use basically operation clones array returns reference new array also note references strings numbers actual object copies object references new array original new array refer object referenced object changes changes visible new original arrays primitives strings numbers immutable changes string number impossible,https://stackoverflow.com/questions/7486085
java array,"From an array of objects, extract value of a property as array",shorter way achieving also check,https://stackoverflow.com/questions/19590865
java array,Find object by id in an array of JavaScript objects,use method mdn method returns first value array element array satisfies provided testing function otherwise returned want find index instead use mdn method returns index first element array satisfies provided testing function otherwise returned want get array matching elements use method instead return array objects want get array properties method side note methods like arrow functions supported older browsers like ie want support browsers transpile code using babel polyfill,https://stackoverflow.com/questions/7364150
java array,How do I efficiently iterate over each entry in a Java Map?,java,https://stackoverflow.com/questions/46898
java array,How to append something to an array?,use method append values end array use function append one value array single call update want add items one array another array use update addition answer want prepend value start array first index use purpose also supports appending multiple values like update another way es syntax return new array spread syntax leaves original array unchanged returns new array new items appended compliant spirit functional programming,https://stackoverflow.com/questions/351409
socket error,How to fix npm throwing error without sudo,looks like permissions issue home directory reclaim ownership npm directory execute,https://stackoverflow.com/questions/16151018
socket error,"ssh ""permissions are too open""",keys need read writable alternatively keys readable also blocks write access appears better cases need change file permissions later edit see comments nuances relevant portion manpage,https://stackoverflow.com/questions/9270734
socket error,Transport security has blocked a cleartext HTTP,use nsapptransportsecurity set nsallowsarbitraryloads key yes nsapptransportsecurity dictionary info plist file,https://stackoverflow.com/questions/31254725
socket error,echo that outputs to stderr,could facilitates reading copies file descriptor file descriptor therefore redirection performed file descriptors refer file one file descriptor originally referring information see bash hackers illustrated redirection tutorial,https://stackoverflow.com/questions/2990414
socket error,fatal error: Python.h: No such file or directory,looks like properly installed header files static libraries python dev use package manager install system wide ubuntu debian centos rhel fedora opensuse alpine cygwin note python dev automatically cover minor versions python using python may need install python dev,https://stackoverflow.com/questions/21530577
socket error,Message 'src refspec master does not match any' when pushing commits in Git,maybe need commit ran oops never committed success,https://stackoverflow.com/questions/4181861
socket error,.gitignore is ignored by Git,even tracked files far git seems able quot know quot even add warning first commit stash current changes lose run following commands top folder git repository,https://stackoverflow.com/questions/11451535
socket error,How to concatenate string variables in Bash,general concatenate two variables write one another,https://stackoverflow.com/questions/4181703
socket error,Determine whether an array contains a value,jquery utility function returns index returns contain see also check array includes object javascript,https://stackoverflow.com/questions/1181575
socket error,Why there are two ways to unstage a file in Git?,unstage file actually stages removal file repo assuming already committed leaves file working tree leaving untracked file unstage staged changes given file said used new file staged would basically look like unstaged since never committed update git newer version git use instead see git docs,https://stackoverflow.com/questions/6919121
java version ,Download a specific tag with Git,give whole repository clone list tags checkout specific tag even better checkout create branch otherwise branch named revision number tag,https://stackoverflow.com/questions/791959
java version ,What are the correct version numbers for C#?,c# language version history versions c# known time writing c# released net vs january c# bizarrely enough released net vs april first version call implemented small features c# released net vs november major new features generics anonymous methods nullable types iterator blocks c# released net vs november major new features lambda expressions extension methods expression trees anonymous types implicit typing query expressions c# released net vs april major new features late binding delegate interface generic variance com support named arguments tuple data type optional parameters c# released net vs august major features async programming caller info attributes breaking change loop variable closure c# released net vs july implemented roslyn features initializers automatically implemented properties using directives import static members exception filters element initializers extension methods collection initializers c# released net vs march major new features tuples ref locals ref return pattern matching including pattern based switch statements inline parameter declarations local functions binary literals digit separators arbitrary async returns c# released vs august new features async main tuple member name inference default expression pattern matching generics c# released vs november new features private protected access modifier span lt gt aka interior pointer aka stackonly struct everything else c# released vs may new features enum delegate generic type constraints reassignment unsafe improvements initialization unpinned indexed buffers custom statements improved overloading resolution expression variables initializers queries defined tuples auto properties backing fields targeted attributes c# released net core vs september major new features nullable reference types asynchronous streams indices ranges readonly members using declarations default interface methods static local functions enhancement interpolated verbatim strings c# released net vs november major new features init properties records expressions data classes positional records top level programs improved pattern matching simple type patterns relational patterns logical patterns improved target typing target type expressions target typed covariant returns minor features relax ordering modifiers parameter null checking lambda discard parameters native attributes local functions function pointers static lambdas extension module initializers extending partial c# released net november major new features record structs struct parameterless constructors interpolated string handlers global directives file scoped namespace declarations extended property patterns const interpolated strings mixed assignment declaration deconstruction async method builders via attributes individual methods attribute parameters enhanced pragmas response op question correct version numbers c# came find answers c# thing c# cause confusion c# present net language framework versioned independently however clr version net net introducing clr service packs notwithstanding clr net various improvements versioning unclear places may referred clr msdn page used refer way example property still reports xxx may c# language team created history c# versions features github repository features added c# language versions also page tracks upcoming recently implemented language features,https://stackoverflow.com/questions/247621
java version ,Why does Java have transient fields?,keyword java used indicate field part serialization means saved like file process java language specification java se edition section fields variables may marked indicate part persistent state object example may fields derived fields done programmatically rather state persisted via serialization class contains image thumbnail derived image example thumbnail image generated invoking method field marked original serialized rather persisting original image thumbnail image means less storage would needed save serialized object course may may desirable depending requirements system example time deserialization method called perform operations necessary restore state object back state serialization occurred thumbnail needs generated method overridden thumbnail generated calling method additional information article discover secrets java serialization api originally available sun developer network section discusses use presents scenario keyword used prevent serialization certain fields,https://stackoverflow.com/questions/910374
java version ,Homebrew install specific version of formula?,tldr see answer details edited answer give thorough workflow installing using older software versions homebrew feel free add note found old version better let start simplest case check whether version already installed activated homebrew installs new formula puts versioned directory like symbolic links folder installed globally principle makes pretty easy switch two installed versions using homebrew longer never removed older versions using example chances older version program may still around want simply activate previous version easiest way check whether older version installed see older version already installed may activate using let double check activated note star moved newly activated version please note works long dependencies older version still around cases rebuild older version may become necessary therefore using mostly useful one wants switch two versions far apart check whether version available tap especially larger software projects probably high enough demand several potentially api incompatible major versions certain piece software march homebrew provides mechanism amp homebrew versions repository versions repository may include backports older versions several formulae mostly large famous ones course also several formulae postgresql show look simply install typing note automatically tapped tap check remove following would equivalent long backported version formulae stay date approach probably best way deal older software try formula past following approaches listed mostly completeness try resurrect undead formula brew repository due changed dependencies api changes formula spec simply change download url things may may work since whole formula directory git repository one install specific versions using plain git commands however need find way get commit old version available historic times august october homebrew command spat available versions respective sha hashes october use name tap suggests probably last resort see advises using homebrew spits versions find internal heuristic shows way retrieve old formulae let try older postgresql version installed install latest formula order keep repository clean friend change old new prehistoric times special needs may also try digging homebrew repo looks commits string either added removed file get two commits result obviously commit interested commit pretty old try downgrade complete homebrew installation way formula api less guaranteed valid may skip last command keep reference git repository one note checking older commit temporarily downgrade homebrew installation careful commands homebrew might different recent version manually write formula hard may upload repository used homebrew versions discontinued bonus pinning want keep certain version say postgresql around stop updated natural procedure pin formula pinned formulae listed want bring latest changes updates unpin,https://stackoverflow.com/questions/3987683
java version ,How do I efficiently iterate over each entry in a Java Map?,java,https://stackoverflow.com/questions/46898
java version ,Use different Python version with virtualenv,note python see aelfinn answer use short option creating virtualenv instance specify python executable want use,https://stackoverflow.com/questions/1534210
java version ,"Is Java ""pass-by-reference"" or ""pass-by-value""?",terms quot pass value quot quot pass reference quot special precisely defined meanings computer science meanings differ intuition many people first hearing terms much confusion discussion seems come fact terms quot pass value quot quot pass reference quot talking variables pass value means value variable passed function method pass reference means reference variable passed function latter gives function way change contents variable definitions java always pass value unfortunately deal variables holding objects really dealing object handles called references passed value well terminology semantics easily confuse many beginners goes like example still return value within changed function object reference passed value passed reference would return call likewise example dog name call object name set inside operations performs practical purposes performed possible change value variable information pass reference pass value consult following answer https stackoverflow com explains thoroughly semantics history behind two also explains java many modern languages appear certain cases,https://stackoverflow.com/questions/40480
java version ,How do I declare and initialize an array in Java?,either use array declaration array literal declare affect variable right away array literals cannot used assigning array primitive types classes example third way initializing useful declare array first initialize pass array function argument return array explicit type required,https://stackoverflow.com/questions/1200621
java version ,How do I break out of nested loops in Java?,like answerers would definitely prefer put loops different method point return stop iterating completely answer shows requirements question met use label outer loop example prints,https://stackoverflow.com/questions/886955
java version ,How can I create a memory leak in Java?,good way create true memory leak objects inaccessible running code still stored memory pure java application creates long running thread use thread pool leak even faster thread loads class via optionally custom class allocates large chunk memory stores strong reference static field stores reference allocating extra memory optional leaking class instance enough make leak work much faster application clears references custom class loaded repeat due way implemented oracle jdk creates memory leak private field actually stores thread local values key map weak reference object object garbage collected entry removed map value strong reference value directly indirectly points object key object neither garbage collected removed map long thread lives example chain strong references looks like object map instance example class example class static field object really play role creating leak makes leak worse additional reference chain example class classes loaded even worse many jvm implementations especially prior java classes allocated straight permgen never garbage collected variation pattern application containers like tomcat leak memory like sieve frequently redeploy applications happen use way point back happen number subtle reasons often hard debug fix update since lots people keep asking example code shows behavior action,https://stackoverflow.com/questions/6470651
python version,Use different Python version with virtualenv,note python see aelfinn answer use short option creating virtualenv instance specify python executable want use,https://stackoverflow.com/questions/1534210
python version,Download a specific tag with Git,give whole repository clone list tags checkout specific tag even better checkout create branch otherwise branch named revision number tag,https://stackoverflow.com/questions/791959
python version,What are the correct version numbers for C#?,c# language version history versions c# known time writing c# released net vs january c# bizarrely enough released net vs april first version call implemented small features c# released net vs november major new features generics anonymous methods nullable types iterator blocks c# released net vs november major new features lambda expressions extension methods expression trees anonymous types implicit typing query expressions c# released net vs april major new features late binding delegate interface generic variance com support named arguments tuple data type optional parameters c# released net vs august major features async programming caller info attributes breaking change loop variable closure c# released net vs july implemented roslyn features initializers automatically implemented properties using directives import static members exception filters element initializers extension methods collection initializers c# released net vs march major new features tuples ref locals ref return pattern matching including pattern based switch statements inline parameter declarations local functions binary literals digit separators arbitrary async returns c# released vs august new features async main tuple member name inference default expression pattern matching generics c# released vs november new features private protected access modifier span lt gt aka interior pointer aka stackonly struct everything else c# released vs may new features enum delegate generic type constraints reassignment unsafe improvements initialization unpinned indexed buffers custom statements improved overloading resolution expression variables initializers queries defined tuples auto properties backing fields targeted attributes c# released net core vs september major new features nullable reference types asynchronous streams indices ranges readonly members using declarations default interface methods static local functions enhancement interpolated verbatim strings c# released net vs november major new features init properties records expressions data classes positional records top level programs improved pattern matching simple type patterns relational patterns logical patterns improved target typing target type expressions target typed covariant returns minor features relax ordering modifiers parameter null checking lambda discard parameters native attributes local functions function pointers static lambdas extension module initializers extending partial c# released net november major new features record structs struct parameterless constructors interpolated string handlers global directives file scoped namespace declarations extended property patterns const interpolated strings mixed assignment declaration deconstruction async method builders via attributes individual methods attribute parameters enhanced pragmas response op question correct version numbers c# came find answers c# thing c# cause confusion c# present net language framework versioned independently however clr version net net introducing clr service packs notwithstanding clr net various improvements versioning unclear places may referred clr msdn page used refer way example property still reports xxx may c# language team created history c# versions features github repository features added c# language versions also page tracks upcoming recently implemented language features,https://stackoverflow.com/questions/247621
