input,title,answers,url
git branch,How can I merge multiple commits onto another branch as a single squashed commit?,say bug fix branch called want merge take commits branch squash commit merge branch explanation switches branch takes commits branch groups commit current branch merge commit appears could resolve conflicts manually following commit creates single commit merged changes omitting parameter lets modify draft commit message containing every message squashed commits finalizing commit,https://stackoverflow.com/questions/5308816
git branch,"How to replace master branch in Git, entirely, from another branch?",able use merge strategy overwrite master seotweaks like result master essentially seotweaks short docs strategy resolves number heads resulting tree merge always current branch head effectively ignoring changes branches meant used supersede old development history side branches note different xours option recursive merge strategy update comments get fatal change second line git,https://stackoverflow.com/questions/2862590
git branch,Make the current Git branch a master branch,problem two answers new master old master ancestor push everyone else get messed want want history little clearer would recommend adding information merge commit message make clear done change second line,https://stackoverflow.com/questions/2763006
git branch,Create a branch in Git from another branch,like method link posted look git flow set scripts created workflow answer question creates myfeature branch dev work merge changes dev without fast forward push changes server see want,https://stackoverflow.com/questions/4470523
git branch,How to get just one file from another branch?,see also git undo changes one file update august git new commands would default working tree restored want update index well meaning restore file content add index one command jakub nar bski mentions comments works except detailed question quot retrieve single file specific revision git quot need use full path root directory repo hence path app js used jakub example frosty mentions comment get recent state app js actually reference revision want illustrated question quot git checkout revision file git gui quot would filename full path versioned file shown schmijos adds comments also stash useful working two branches want commit,https://stackoverflow.com/questions/2364147
git branch,Can I recover a branch after its deletion in Git?,yes able find sha commit tip deleted branch commit recreate branch credit cascabel condensed one liner version snowcrash obtain sha deleted branch see something like terminal use one liner,https://stackoverflow.com/questions/3640764
git branch,How to compare a local Git branch with its remote branch,example course said remote tracking branch need first need date information branches remote repository,https://stackoverflow.com/questions/1800783
git branch,How do I check out a remote Git branch?,answer split depending whether one remote repository configured multiple reason single remote case commands simplified less ambiguity updated git older versions see section end one remote cases start fetching remote repository make sure latest changes downloaded fetch remote branches see branches available checkout branches start thought read copies remote branches work branch need create local branch done git command since git giving name remote branch minus remote name case git guessing disabled trying checkout track remote branch name multiple remotes case multiple remote repositories exist remote repository needs explicitly named start fetching latest remote changes fetch remote branches see branches available checkout remote branches hand need check branch interested create new local branch information using also created image share differences look fetch works also different pull prior git added git prior used switch branches checkout single remote repository multiple remote repositories configured becomes bit longer,https://stackoverflow.com/questions/1783405
git branch,Undoing a git rebase,easiest way would find head commit branch immediately rebase started reflog reset current branch usual caveats absolutely sure reseting option suppose old commit ref log windows may need quote reference check history candidate old head windows disabled per branch reflogs able simply rebase detaches branch head reattaching final head would double check though verified recently per default reflogs activated non bare repositories,https://stackoverflow.com/questions/134882
git branch,How do I diff the same file between two different commits on the same branch?,manpage instance see difference file main two commits back three equivalent commands,https://stackoverflow.com/questions/3338126
ArithmeticException,How to insert an item into an array at a specific index (JavaScript),want function native array object insert specified deleting items first insert example create array add element index,https://stackoverflow.com/questions/586182
ArithmeticException,"What is the ""-->"" operator in C++?",operator fact two separate operators conditional code decrements returning original decremented value compares original value using operator better understand statement could written follows,https://stackoverflow.com/questions/1642028
ArithmeticException,How can I delete all of my Git stashes at once?,following command deletes stashes git documentation remove stashed states important warning states subject pruning may impossible recover,https://stackoverflow.com/questions/11369375
ArithmeticException,window.onload vs $(document).ready(),event occurs html document loaded event occurs later content images also loaded event standard event dom event specific jquery purpose event occur early possible document loaded code adds functionality elements page wait content load,https://stackoverflow.com/questions/3698200
ArithmeticException,How do you do block comments in YAML?,yaml supports inline comments support block comments wikipedia comments begin number sign start anywhere line continue end line comparison json also wikipedia syntax differences subtle seldom arise practice json allows extended charactersets like utf yaml requires space separators like comma equals colon json non standard implementations json extend grammar include javascript comments handling edge cases may require light pre processing json parsing line yaml,https://stackoverflow.com/questions/2276572
ArithmeticException,What does enctype='multipart/form-data' mean?,make post request encode data forms body request way html forms provide three methods encoding default work done adding abandoned encodings possible http requests generated using means html form submission json common format use web services still use soap specifics formats matter developers important points never use writing client side code use form includes elements otherwise use efficient writing server side code use prewritten form handling library perl one exposed php superglobal take care differences bother trying parse raw input received server sometimes find library handle formats node js popular library handling form data body parser cannot handle multipart requests documentation recommends alternatives writing debugging library parsing generating raw data need start worrying format might also want know interest sake less query string end url significantly complicated allows entire files included data example result found html specification introduced html useful debugging spec reliably interpretable computer would argue others combined tools like network panel developer tools browsers better,https://stackoverflow.com/questions/4526273
ArithmeticException,JavaScriptSerializer - JSON serialization of enum as string,found json net provides exact functionality looking attribute details available documentation places configure converter globally enum want enum always serialized deserialized string case anyone wants avoid attribute decoration add converter jsonserializer suggested bj rn egil work every enum sees serialization suggested travis jsonconverter suggested banana additionally control casing whether numbers still accepted using stringenumconverter namingstrategy boolean constructor,https://stackoverflow.com/questions/2441290
ArithmeticException,How to check if a string contains a substring in Bash,use marcus answer wildcards outside case statement use double brackets note spaces needle string need placed double quotes wildcards outside also note simple comparison operator used regex operator,https://stackoverflow.com/questions/229551
ArithmeticException,Break a previous commit into multiple commits,first start clean working directory show pending modifications deletions additions decide commit want split splitting recent commit split apart recent commit first commit pieces individually usual way producing many commits need splitting commit farther back requires rebasing rewriting history specify correct commit several choices three commits back many commits back farther back tree want count sha commit want split different branch feature branch want merge get rebase edit screen find commit want break apart beginning line replace short save buffer exit rebase stop commit want edit commit pieces individually usual way producing many commits need finally,https://stackoverflow.com/questions/6217156
ArithmeticException,What is the difference between call and apply?,difference lets invoke function array requires parameters listed explicitly useful mnemonic quot rray omma quot see mdn documentation apply call pseudo syntax also es possibility array use function see compatibilities sample code,https://stackoverflow.com/questions/1986896
check out a remote Git,Git fetch remote branch,update using git switch information written accurate new command added simplifies effort exists remote repository local branch simply type since branch locally automatically make look remote repo also automatically set remote branch tracking note exist locally need first using original post need create local branch tracks remote branch following command create local branch named daves branch tracking remote branch origin daves branch push changes remote branch updated recent versions git shorthand remotename origin case branch twice daves branch case git needed git higher enough might started earlier earliest confirmation could find quickly note recent git versions command create local branch put wouldetached head state want local branch use option full details git branching remote branches tracking branches,https://stackoverflow.com/questions/9537392
check out a remote Git,How do I clone all remote branches?,first clone remote git repository next look local branches repository branches hiding repository see using flag take quick peek upstream branch check directly work branch create local tracking branch done automatically quot new branch quot simply means branch taken index created locally previous line tells branch set track remote branch usually means origin branch name branch local branches show track one remote repository using point things getting pretty crazy run see going,https://stackoverflow.com/questions/67699
check out a remote Git,How do you push a tag to a remote repository using Git?,push single tag following command push tags recommended,https://stackoverflow.com/questions/5195859
check out a remote Git,How to check if a variable is set in Bash,usually right way parameter expansion evaluates nothing unset substitutes string otherwise quotes digression quotes omitted say instead syntax amp usage guarantees expand something require quotes since either expands contains word breaks needs quotes nothing results conveniently evaluates value true well however quotes safely omitted immediately obvious even apparent first author quotes explanation also major bash coder would sometimes better write solution quotes small possible cost speed penalty first author also added comment next code using solution giving url answer also includes explanation quotes safely omitted often wrong way often wrong distinguish variable unset variable set empty string say solution output quot var blank quot distinction unset quot set empty string quot essential situations user specify extension additional list properties specifying defaults non empty value whereas specifying empty string make script use empty extension list additional properties distinction may essential every scenario though cases fine,https://stackoverflow.com/questions/3601515
check out a remote Git,How to fully delete a git repository created with init?,git keeps files directory remove one init find hidden windows need go folder click organize top left click folder search options click view tab click show hidden files folders drives radio button mac os open terminal via spotlight press cmd space type press enter run note keyboard shortcut show hidden files finder cmd shift longer necessary modify finder config way could also type space important drag drop git repo folder finder terminal window press return type return ubuntu use shortcut ctrl,https://stackoverflow.com/questions/1213430
check out a remote Git,How to use SSH to run a local shell script on a remote machine?,machine windows box use plink part putty parameter execute local script remote server machine unix based system use copy script remote server run,https://stackoverflow.com/questions/305035
check out a remote Git,Check synchronously if file/directory exists in Node.js,answer question changed years current answer top followed various answers years chronological order current answer use deprecated several years longer docs note deprecated callback parameter accepts parameters inconsistent node js callbacks use callback specifically asked synchronous check use asynchronous check instead usually best use using functions since deprecated function callback historical answers historical answers chronological order original answer update september update february noting impending deprecation probably back update december also note file directory exist error docs recommend using need check existence without opening update december still deprecated longer deprecated safely use original answer use docs link give object general synchronous version function available name async version end synchronous version synchronous version etc tells whether something exists whether file directory file systems symbolic link block device character device etc need know exists directory similarly file block device etc etc note throws error entry exist care entry want know whether exists use latest noted user require gives information thing deprecated long ago side note expressly asked check synchronously used versions functions wherever possible really best avoid synchronous calls calls subsystem take significant time cpu point view note easy call rather need synchronous version update september answer couple years ago bit date current way use synchronous check file directory existence course asynchronous check rather versions example update february node docs say deprecated node folks think dumb check whether something exists opening reason checking whether something exists probably back various methods unless changes yet course update december know long also least october documentation recommends using existence checks check file exists without manipulating afterwards recommended note access available considered error would probably best expecting file accessible update december use deprecated several years longer docs note deprecated callback parameter accepts parameters inconsistent node js callbacks use callback,https://stackoverflow.com/questions/4482686
check out a remote Git,How can I check for an active Internet connection on iOS or macOS?,important check always performed asynchronously majority answers synchronous careful otherwise freeze app swift install via cocoapods carthage https github com ashleymills reachability swift test reachability via closures objective add framework project worry including anywhere add tony million version project found https github com tonymillion reachability update interface section implement method file view controller call important note class one used classes projects might run naming conflicts projects happens rename one pairs files something else resolve issue note domain use matter testing gateway domain,https://stackoverflow.com/questions/1083701
check out a remote Git,How can I delete all of my Git stashes at once?,following command deletes stashes git documentation remove stashed states important warning states subject pruning may impossible recover,https://stackoverflow.com/questions/11369375
check out a remote Git,"How do I ""git clone"" a repo, including its submodules?",version git later used instead editor note optional performance optimization became available version fetches submodules time parallel see version git version flag available version version git later use already cloned repos older git versions use,https://stackoverflow.com/questions/3796927
How can I merge multiple commits onto another branch as a single squashed commit?,Break a previous commit into multiple commits,first start clean working directory show pending modifications deletions additions decide commit want split splitting recent commit split apart recent commit first commit pieces individually usual way producing many commits need splitting commit farther back requires rebasing rewriting history specify correct commit several choices three commits back many commits back farther back tree want count sha commit want split different branch feature branch want merge get rebase edit screen find commit want break apart beginning line replace short save buffer exit rebase stop commit want edit commit pieces individually usual way producing many commits need finally,https://stackoverflow.com/questions/6217156
How can I merge multiple commits onto another branch as a single squashed commit?,Undoing a git rebase,easiest way would find head commit branch immediately rebase started reflog reset current branch usual caveats absolutely sure reseting option suppose old commit ref log windows may need quote reference check history candidate old head windows disabled per branch reflogs able simply rebase detaches branch head reattaching final head would double check though verified recently per default reflogs activated non bare repositories,https://stackoverflow.com/questions/134882
How can I merge multiple commits onto another branch as a single squashed commit?,Move the most recent commit(s) to a new branch with Git,moving existing branch want move commits existing branch look like store uncommitted edits stash using complete retrieve stashed uncommitted edits moving new branch warning method works creating new branch first command want move commits existing branch need merge changes existing branch executing see moving existing branch merge changes first lost unless circumstances involved easily done branching rolling back make sure many commits go back alternatively instead simply provide hash commit reference like origin master want quot revert back quot master current branch quot losing quot commits master branch worry commits newbranch lastly may need force push latest changes main repo warning git version later later new branch upon original branch may need explicit option rebase avoid losing carried commits set makes likely see john mellor answer details,https://stackoverflow.com/questions/1628563
How can I merge multiple commits onto another branch as a single squashed commit?,Viewing unpushed Git commits,gives log commits origin master head head master branch gives log unpushed commits similarly view diff,https://stackoverflow.com/questions/2016901
How can I merge multiple commits onto another branch as a single squashed commit?,How do I diff the same file between two different commits on the same branch?,manpage instance see difference file main two commits back three equivalent commands,https://stackoverflow.com/questions/3338126
How can I merge multiple commits onto another branch as a single squashed commit?,Inserting multiple rows in a single SQL query?,sql server insert multiple rows using single sql insert statement reference look moc course writing sql queries sql server example,https://stackoverflow.com/questions/452859
How can I merge multiple commits onto another branch as a single squashed commit?,How can I merge multiple commits onto another branch as a single squashed commit?,say bug fix branch called want merge take commits branch squash commit merge branch explanation switches branch takes commits branch groups commit current branch merge commit appears could resolve conflicts manually following commit creates single commit merged changes omitting parameter lets modify draft commit message containing every message squashed commits finalizing commit,https://stackoverflow.com/questions/5308816
How can I merge multiple commits onto another branch as a single squashed commit?,How do I change the author and committer name/email for multiple commits?,note answer changes sha take care using branch already pushed want fix spelling name update old email git lets without rewriting history using see answer using rebase first already done likely want fix name git config optional also make sure reset committer name assuming need rewrite metadata range commits using rebase run step commit rewritten ran repeatedly also want change first commit also called root commit add rebase call change committer author configuration want change config use instead note update committer author single commit want change recent commit rebase necessary amend commit older git clients pre july may exist replacement use note serious issues deprecated,https://stackoverflow.com/questions/750172
How can I merge multiple commits onto another branch as a single squashed commit?,"How to replace master branch in Git, entirely, from another branch?",able use merge strategy overwrite master seotweaks like result master essentially seotweaks short docs strategy resolves number heads resulting tree merge always current branch head effectively ignoring changes branches meant used supersede old development history side branches note different xours option recursive merge strategy update comments get fatal change second line git,https://stackoverflow.com/questions/2862590
How can I merge multiple commits onto another branch as a single squashed commit?,Create a branch in Git from another branch,like method link posted look git flow set scripts created workflow answer question creates myfeature branch dev work merge changes dev without fast forward push changes server see want,https://stackoverflow.com/questions/4470523
How do I delete a Git branch locally and remotely,How do I delete a Git branch locally and remotely?,executive summary note cases delete local branch delete local branch use one following option alias deletes branch already fully merged upstream branch option alias deletes branch quot irrespective merged status quot source git delete learned honor force flag receive error try delete currently selected branch delete remote branch git delete remote branch using might easier remember added git quot delete remote branch tag quot starting git also use option alias therefore version git installed dictate whether need use easier harder syntax delete remote branch original answer jan chapter pro git scott chacon deleting remote branches suppose done remote branch say collaborators finished feature merged remote main branch whatever branch stable code line delete remote branch using rather obtuse syntax want delete server fix branch server run following boom branches server may want dog ear page need command likely forget syntax way remember command recalling syntax went bit earlier leave portion basically saying take nothing side make issued worked beautifully scott chacon right want dog ear page virtually dog ear answering stack overflow execute machines propagate changes,https://stackoverflow.com/questions/2003505
How do I delete a Git branch locally and remotely,How can I delete all of my Git stashes at once?,following command deletes stashes git documentation remove stashed states important warning states subject pruning may impossible recover,https://stackoverflow.com/questions/11369375
How do I delete a Git branch locally and remotely,How can I merge multiple commits onto another branch as a single squashed commit?,say bug fix branch called want merge take commits branch squash commit merge branch explanation switches branch takes commits branch groups commit current branch merge commit appears could resolve conflicts manually following commit creates single commit merged changes omitting parameter lets modify draft commit message containing every message squashed commits finalizing commit,https://stackoverflow.com/questions/5308816
How do I delete a Git branch locally and remotely,How do I delete all Git branches which have been merged?,note add branches exclude like master dev workflow possible ancestor usually branch quot sprint start quot tag master dev qa ancestors first list locally tracking branches merged remote consider using flag list remote tracking branches might see branches want remove add arguments skip important branches want delete like master develop following command skip master branch anything dev want skip add egrep command like following branch deleted delete local branches already merged currently checked branch see master dev excluded case ancestor delete merged local branch merged use delete remote use delete branch remote prune get rid remote tracking branches prune individual remote tracking branches answer suggests,https://stackoverflow.com/questions/6127328
