input,title,answers,url
java array,Why does Java have transient fields?,keyword java used indicate field part serialization means saved like file process java language specification java se edition section fields variables may marked indicate part persistent state object example may fields derived fields done programmatically rather state persisted via serialization class contains image thumbnail derived image example thumbnail image generated invoking method field marked original serialized rather persisting original image thumbnail image means less storage would needed save serialized object course may may desirable depending requirements system example time deserialization method called perform operations necessary restore state object back state serialization occurred thumbnail needs generated method overridden thumbnail generated calling method additional information article discover secrets java serialization api originally available sun developer network section discusses use presents scenario keyword used prevent serialization certain fields,https://stackoverflow.com/questions/910374
java array,"Is Java ""pass-by-reference"" or ""pass-by-value""?",terms quot pass value quot quot pass reference quot special precisely defined meanings computer science meanings differ intuition many people first hearing terms much confusion discussion seems come fact terms quot pass value quot quot pass reference quot talking variables pass value means value variable passed function method pass reference means reference variable passed function latter gives function way change contents variable definitions java always pass value unfortunately deal variables holding objects really dealing object handles called references passed value well terminology semantics easily confuse many beginners goes like example still return value within changed function object reference passed value passed reference would return call likewise example dog name call object name set inside operations performs practical purposes performed possible change value variable information pass reference pass value consult following answer https stackoverflow com explains thoroughly semantics history behind two also explains java many modern languages appear certain cases,https://stackoverflow.com/questions/40480
java array,What's the simplest way to print a Java array?,since java use arrays within arrays note version calls object array output even decorated exact way asking examples simple array output nested array output array output array output,https://stackoverflow.com/questions/409784
java array,Loop through an array in JavaScript,three main options detailed examples sequential loop pros works every environment use flow control statements cons verbose imperative easy one errors sometimes also called fence post error es specification introduced lot beneficial array methods one gave us concise way iterate array almost ten years time writing es specification released dec implemented nearly modern engines desktop server mobile environments safe use es arrow function syntax even succinct arrow functions also widely implemented unless plan support ancient platforms internet explorer also safe go pros short succinct declarative cons cannot use normally replace need imperative loops filtering array elements iterating example keep mind iterating array build another array use seen anti pattern many times anti pattern proper use case map also trying reduce array value example want sum array numbers use reduce method anti pattern proper use reduce es statement es standard introduces concept iterable objects defines new construct traversing data statement statement works kind iterable object also generators object property array objects definition built iterables es use statement pros iterate large variety objects use normal flow control statements useful iterate serially asynchronous values cons targeting older browsers transpiled output might surprise use zipcodeman suggests use statement iterating arrays avoided statement meant enumerate object properties used array like objects order iteration guaranteed array indexes may visited numeric order inherited properties also enumerated second point give lot problems example extend object include method property also enumerated example code console log quot quot quot quot quot quot quot foo quot particularly problem use library relies heavily native prototypes augmentation mootools statement said enumerate object properties example example method allows enumerate properties properties object physically inherited properties would recommend read following article enumeration vs iteration,https://stackoverflow.com/questions/3010840
java array,Copy array by value,use basically operation clones array returns reference new array also note references strings numbers actual object copies object references new array original new array refer object referenced object changes changes visible new original arrays primitives strings numbers immutable changes string number impossible,https://stackoverflow.com/questions/7486085
java array,"From an array of objects, extract value of a property as array",shorter way achieving also check,https://stackoverflow.com/questions/19590865
java array,Find object by id in an array of JavaScript objects,use method mdn method returns first value array element array satisfies provided testing function otherwise returned want find index instead use mdn method returns index first element array satisfies provided testing function otherwise returned want get array matching elements use method instead return array objects want get array properties method side note methods like arrow functions supported older browsers like ie want support browsers transpile code using babel polyfill,https://stackoverflow.com/questions/7364150
java array,How do I efficiently iterate over each entry in a Java Map?,java,https://stackoverflow.com/questions/46898
java array,How to append something to an array?,use method append values end array use function append one value array single call update want add items one array another array use update addition answer want prepend value start array first index use purpose also supports appending multiple values like update another way es syntax return new array spread syntax leaves original array unchanged returns new array new items appended compliant spirit functional programming,https://stackoverflow.com/questions/351409
python version,Use different Python version with virtualenv,note python see aelfinn answer use short option creating virtualenv instance specify python executable want use,https://stackoverflow.com/questions/1534210
python version,Download a specific tag with Git,give whole repository clone list tags checkout specific tag even better checkout create branch otherwise branch named revision number tag,https://stackoverflow.com/questions/791959
python version,What are the correct version numbers for C#?,c# language version history versions c# known time writing c# released net vs january c# bizarrely enough released net vs april first version call implemented small features c# released net vs november major new features generics anonymous methods nullable types iterator blocks c# released net vs november major new features lambda expressions extension methods expression trees anonymous types implicit typing query expressions c# released net vs april major new features late binding delegate interface generic variance com support named arguments tuple data type optional parameters c# released net vs august major features async programming caller info attributes breaking change loop variable closure c# released net vs july implemented roslyn features initializers automatically implemented properties using directives import static members exception filters element initializers extension methods collection initializers c# released net vs march major new features tuples ref locals ref return pattern matching including pattern based switch statements inline parameter declarations local functions binary literals digit separators arbitrary async returns c# released vs august new features async main tuple member name inference default expression pattern matching generics c# released vs november new features private protected access modifier span lt gt aka interior pointer aka stackonly struct everything else c# released vs may new features enum delegate generic type constraints reassignment unsafe improvements initialization unpinned indexed buffers custom statements improved overloading resolution expression variables initializers queries defined tuples auto properties backing fields targeted attributes c# released net core vs september major new features nullable reference types asynchronous streams indices ranges readonly members using declarations default interface methods static local functions enhancement interpolated verbatim strings c# released net vs november major new features init properties records expressions data classes positional records top level programs improved pattern matching simple type patterns relational patterns logical patterns improved target typing target type expressions target typed covariant returns minor features relax ordering modifiers parameter null checking lambda discard parameters native attributes local functions function pointers static lambdas extension module initializers extending partial c# released net november major new features record structs struct parameterless constructors interpolated string handlers global directives file scoped namespace declarations extended property patterns const interpolated strings mixed assignment declaration deconstruction async method builders via attributes individual methods attribute parameters enhanced pragmas response op question correct version numbers c# came find answers c# thing c# cause confusion c# present net language framework versioned independently however clr version net net introducing clr service packs notwithstanding clr net various improvements versioning unclear places may referred clr msdn page used refer way example property still reports xxx may c# language team created history c# versions features github repository features added c# language versions also page tracks upcoming recently implemented language features,https://stackoverflow.com/questions/247621
python version,Homebrew install specific version of formula?,tldr see answer details edited answer give thorough workflow installing using older software versions homebrew feel free add note found old version better let start simplest case check whether version already installed activated homebrew installs new formula puts versioned directory like symbolic links folder installed globally principle makes pretty easy switch two installed versions using homebrew longer never removed older versions using example chances older version program may still around want simply activate previous version easiest way check whether older version installed see older version already installed may activate using let double check activated note star moved newly activated version please note works long dependencies older version still around cases rebuild older version may become necessary therefore using mostly useful one wants switch two versions far apart check whether version available tap especially larger software projects probably high enough demand several potentially api incompatible major versions certain piece software march homebrew provides mechanism amp homebrew versions repository versions repository may include backports older versions several formulae mostly large famous ones course also several formulae postgresql show look simply install typing note automatically tapped tap check remove following would equivalent long backported version formulae stay date approach probably best way deal older software try formula past following approaches listed mostly completeness try resurrect undead formula brew repository due changed dependencies api changes formula spec simply change download url things may may work since whole formula directory git repository one install specific versions using plain git commands however need find way get commit old version available historic times august october homebrew command spat available versions respective sha hashes october use name tap suggests probably last resort see advises using homebrew spits versions find internal heuristic shows way retrieve old formulae let try older postgresql version installed install latest formula order keep repository clean friend change old new prehistoric times special needs may also try digging homebrew repo looks commits string either added removed file get two commits result obviously commit interested commit pretty old try downgrade complete homebrew installation way formula api less guaranteed valid may skip last command keep reference git repository one note checking older commit temporarily downgrade homebrew installation careful commands homebrew might different recent version manually write formula hard may upload repository used homebrew versions discontinued bonus pinning want keep certain version say postgresql around stop updated natural procedure pin formula pinned formulae listed want bring latest changes updates unpin,https://stackoverflow.com/questions/3987683
python version,Manually raising (throwing) an exception in Python,manually throw raise exception python use specific exception constructor semantically fits issue specific message raise generic exceptions avoid raising generic catch catch specific exceptions subclass problem hiding bugs example problem catch specific catches catch general exception best practices statement instead use specific exception constructor semantically fits issue also handily allows arbitrary number arguments passed constructor arguments accessed attribute object example prints python actual attribute added favor encouraging users subclass exceptions stop using introduction original deprecation args retracted best practices clause inside except clause might want example log specific type error happened raise best way preserving stack trace use bare raise statement example modify errors insist preserve stacktrace error value way error prone compatibility problems python prefer use bare raise explain returns type value traceback syntax python note compatible python want modify happens new raise setting new instance preserved whole traceback modifying args note best practice invalid syntax python making keeping compatibility much harder work around python avoid manually manipulating tracebacks less efficient error prone using threading may even get wrong traceback especially using exception handling control flow would personally tend avoid python exception chaining python chain exceptions preserve tracebacks aware allow changing error type raised compatible python deprecated methods easily hide even get production code want raise exception raise exception one intended valid python python following valid much older versions python lower may still see people raising strings modern versions actually raise raising type checking right exception reviewer aware issue could get production example usage raise exceptions warn consumers api using incorrectly create error types apropos quot want make error purpose would go except quot create error types want indicate something specific wrong application subclass appropriate point exception hierarchy usage,https://stackoverflow.com/questions/2052390
python version,Replacements for switch statement in Python?,original answer written since python introduced statement provides first class implementation quot switch quot python example statement considerably powerful simple example could use dictionary,https://stackoverflow.com/questions/60208
python version,Is there a way to run Python on Android?,one way use kivy open source python library rapid development applications make use innovative user interfaces multi touch apps kivy runs linux windows os android ios run python code supported platforms kivy showcase app,https://stackoverflow.com/questions/101754
python version,How do I profile a Python script?,python includes profiler called cprofile gives total running time also times function separately tells many times function called making easy determine make optimizations call within code interpreter like even usefully invoke cprofile running script make even easier made little batch file called profile bat run get edit updated link good video resource pycon titled python profiling also via youtube,https://stackoverflow.com/questions/582336
python version,How can I use threading in Python?,since question asked real simplification simple multithreading python map pool code comes article blog post definitely check affiliation parallelism one line better model day day threading tasks summarize ends lines code multithreaded version description map cool little function key easily injecting parallelism python code unfamiliar map something lifted functional languages like lisp function maps another function sequence map handles iteration sequence us applies function stores results handy list end implementation parallel versions map function provided two libraries multiprocessing also little known equally fantastic step child multiprocessing dummy exactly multiprocessing module uses threads instead important distinction use multiple processes cpu intensive tasks threads multiprocessing dummy replicates api multiprocessing wrapper around threading module timing results passing multiple arguments works like python later pass multiple arrays pass constant array using earlier version python pass multiple arguments via workaround thanks user helpful comment,https://stackoverflow.com/questions/2846653
python version,"What is the Python 3 equivalent of ""python -m SimpleHTTPServer""",docs module merged python tool automatically adapt imports converting sources command depending installation,https://stackoverflow.com/questions/7943751
nullpointer,How to insert an item into an array at a specific index (JavaScript),want function native array object insert specified deleting items first insert example create array add element index,https://stackoverflow.com/questions/586182
nullpointer,"What is the ""-->"" operator in C++?",operator fact two separate operators conditional code decrements returning original decremented value compares original value using operator better understand statement could written follows,https://stackoverflow.com/questions/1642028
nullpointer,How can I delete all of my Git stashes at once?,following command deletes stashes git documentation remove stashed states important warning states subject pruning may impossible recover,https://stackoverflow.com/questions/11369375
nullpointer,window.onload vs $(document).ready(),event occurs html document loaded event occurs later content images also loaded event standard event dom event specific jquery purpose event occur early possible document loaded code adds functionality elements page wait content load,https://stackoverflow.com/questions/3698200
nullpointer,How do you do block comments in YAML?,yaml supports inline comments support block comments wikipedia comments begin number sign start anywhere line continue end line comparison json also wikipedia syntax differences subtle seldom arise practice json allows extended charactersets like utf yaml requires space separators like comma equals colon json non standard implementations json extend grammar include javascript comments handling edge cases may require light pre processing json parsing line yaml,https://stackoverflow.com/questions/2276572
nullpointer,What does enctype='multipart/form-data' mean?,make post request encode data forms body request way html forms provide three methods encoding default work done adding abandoned encodings possible http requests generated using means html form submission json common format use web services still use soap specifics formats matter developers important points never use writing client side code use form includes elements otherwise use efficient writing server side code use prewritten form handling library perl one exposed php superglobal take care differences bother trying parse raw input received server sometimes find library handle formats node js popular library handling form data body parser cannot handle multipart requests documentation recommends alternatives writing debugging library parsing generating raw data need start worrying format might also want know interest sake less query string end url significantly complicated allows entire files included data example result found html specification introduced html useful debugging spec reliably interpretable computer would argue others combined tools like network panel developer tools browsers better,https://stackoverflow.com/questions/4526273
nullpointer,JavaScriptSerializer - JSON serialization of enum as string,found json net provides exact functionality looking attribute details available documentation places configure converter globally enum want enum always serialized deserialized string case anyone wants avoid attribute decoration add converter jsonserializer suggested bj rn egil work every enum sees serialization suggested travis jsonconverter suggested banana additionally control casing whether numbers still accepted using stringenumconverter namingstrategy boolean constructor,https://stackoverflow.com/questions/2441290
nullpointer,How to check if a string contains a substring in Bash,use marcus answer wildcards outside case statement use double brackets note spaces needle string need placed double quotes wildcards outside also note simple comparison operator used regex operator,https://stackoverflow.com/questions/229551
nullpointer,Break a previous commit into multiple commits,first start clean working directory show pending modifications deletions additions decide commit want split splitting recent commit split apart recent commit first commit pieces individually usual way producing many commits need splitting commit farther back requires rebasing rewriting history specify correct commit several choices three commits back many commits back farther back tree want count sha commit want split different branch feature branch want merge get rebase edit screen find commit want break apart beginning line replace short save buffer exit rebase stop commit want edit commit pieces individually usual way producing many commits need finally,https://stackoverflow.com/questions/6217156
nullpointer,What is the difference between call and apply?,difference lets invoke function array requires parameters listed explicitly useful mnemonic quot rray omma quot see mdn documentation apply call pseudo syntax also es possibility array use function see compatibilities sample code,https://stackoverflow.com/questions/1986896
nullpointer,How to insert an item into an array at a specific index (JavaScript),want function native array object insert specified deleting items first insert example create array add element index,https://stackoverflow.com/questions/586182
nullpointer,"What is the ""-->"" operator in C++?",operator fact two separate operators conditional code decrements returning original decremented value compares original value using operator better understand statement could written follows,https://stackoverflow.com/questions/1642028
nullpointer,How can I delete all of my Git stashes at once?,following command deletes stashes git documentation remove stashed states important warning states subject pruning may impossible recover,https://stackoverflow.com/questions/11369375
nullpointer,window.onload vs $(document).ready(),event occurs html document loaded event occurs later content images also loaded event standard event dom event specific jquery purpose event occur early possible document loaded code adds functionality elements page wait content load,https://stackoverflow.com/questions/3698200
nullpointer,How do you do block comments in YAML?,yaml supports inline comments support block comments wikipedia comments begin number sign start anywhere line continue end line comparison json also wikipedia syntax differences subtle seldom arise practice json allows extended charactersets like utf yaml requires space separators like comma equals colon json non standard implementations json extend grammar include javascript comments handling edge cases may require light pre processing json parsing line yaml,https://stackoverflow.com/questions/2276572
nullpointer,What does enctype='multipart/form-data' mean?,make post request encode data forms body request way html forms provide three methods encoding default work done adding abandoned encodings possible http requests generated using means html form submission json common format use web services still use soap specifics formats matter developers important points never use writing client side code use form includes elements otherwise use efficient writing server side code use prewritten form handling library perl one exposed php superglobal take care differences bother trying parse raw input received server sometimes find library handle formats node js popular library handling form data body parser cannot handle multipart requests documentation recommends alternatives writing debugging library parsing generating raw data need start worrying format might also want know interest sake less query string end url significantly complicated allows entire files included data example result found html specification introduced html useful debugging spec reliably interpretable computer would argue others combined tools like network panel developer tools browsers better,https://stackoverflow.com/questions/4526273
